57,52,Phillips 66,Petroleum Refining,Oil and gas,U.S.,North America,"$145,496","$2,117",-0.698,"$72,582",13200,13,N,,,N,N,,,,,,,,,,,Emissions intensity target,Other Emission Reduction,Yes,Yes,Yes,"1,2,3",,N,,,,,,N,,,,,,Not Specified,"Yes (CCS-based removals e.g. BECCS, DACCS)",No,Y,"MANUFACTURING EMISSIONS INTENSITY (Scope 1 and 2 Metric Tons of CO2e/MBOE): 50% reduction by 2050 with baseline year 2019
https://www.phillips66.com/sustainability/our-targets/ 
https://phillips66.widen.net/s/xrz9pvmmvh/eyassurance-review-report",2050,,,,,,0,0,0,0,0,0,0,0,0,0,0,0,0,0,0,0,0,0,0,0,0,0,0,0,0,1,0,0,0,1,0,0,0,0,0,0,0,0,0,0,0,0,0,0,0,0,0,0,0,0,0,0,0,N,0,N,N,0,0,N,,N,N,Not Specified,
276,290,Phoenix Pharma,Wholesalers: Health Care,Health care and pharmaceuticals,Germany,Europe,"$53,536.8",$342.8,0.461,"$15,700.6",40885,15,N,,,Y,Y,Committed,,2030,,,,,,,,Carbon neutral(ity),Carbon Neutral,Yes,Yes,Partial,"1,2",C,Y,"We aim to reduce the carbon emissions arising from our own operations by 42 per-cent by 2030 compared to the financial year 2020/21. We also aim to achieve carbon neutrality by 2030 by purchasing carbon credits for our remaining emissions.

",2030,,,,N,,,,,,Yes,No,No,N,,,,,,,,0,0,0,0,0,1,0,1,0,0,0,0,0,0,0,1,0,1,0,0,0,0,1,0,0,0,1,1,0,0,0,0,0,0,0,0,1,1,0,0,0,0,0,0,0,0,1,0,1,1,0,1,0,N,0,V,N,0,Y,Y,,N,Y,Yes,
47,53,Ping An Insurance,"Insurance: Life, Health (stock)",Financial services,China,Asia,"$158,627","$17,596.1",0.454,"$1,775,215",273053,16,N,,,N,N,,,,,,,,,,,Carbon neutral(ity),Carbon Neutral,Yes,Yes,Yes,"1,2,3","C,V",Y,"'In 2021, Ping An fully upgraded its action in green finance, announced its five-year business goals, and committed to achieving carbon neutrality in operation by 2030' (p32)",2030,,,,N,,,,,,Not Specified,"Yes (nature-based removals e.g. Forestation, soil carbon enhancement)",No,N,,,,,,,,0,0,0,0,0,0,0,0,0,0,0,0,0,0,0,1,0,1,0,0,0,0,1,0,0,0,1,0,0,1,0,1,0,1,0,0,0,0,0,0,0,0,0,0,0,0,1,1,1,1,0,1,0,N,0,N,C,Y,0,N,,N,Y,Not Specified,
304,311,Plains GP Holdings,Pipelines,Energy and utilities,U.S.,North America,"$50,073",$103,-0.48,"$27,756",4200,10,N,,,N,N,,,,,,,,,,,,,,,,,,N,,,,,,N,,,,,,Not Specified,,,N,,,,,,,,0,0,0,0,0,0,0,0,0,0,0,0,0,0,0,0,0,0,0,0,0,0,0,0,0,0,0,0,0,1,0,0,0,0,0,0,0,0,0,0,0,0,0,0,0,0,0,0,0,0,0,0,0,N,0,N,N,0,0,N,,N,N,Not Specified,
468,#N/A,PNC Financial Services Group,Superregional Banks,Financial services,U.S.,North America,"$34,437.3","$1,118",-0.227,"$110,153.8",51435,3,N,,,N,N,,,,,,,,,,,Emissions reduction target,Other Emission Reduction,Yes,Yes,No,"1,2",,N,,,,,,N,,,,,,Yes,Not Specified,No,Y,"80% Carbon Emissions Reduction (Scopes 1 & 2) from 2022 baseline by 2030 To achieve this goal, PNC is:
‚Ä¢ Reducing energy and carbon emissions through energy efficiency projects, real estate optimization and electrification, without reliance on the purchase of carbon offsets
‚Ä¢ Executing renewable energy power purchase agreements, installing on-site solar and buying certified renewable energy credits. We remain on track to meet our goal of 100 percent purchased renewable electricity by 2025

Target Emissions (Scopes 1-2 Market-Based) = Baseline (2022) = 117,060; 80% carbon emissions reduction (Scopes 1 & 2) by 2030
",2030,,,,,,0,0,0,0,0,0,0,0,0,0,0,0,0,0,0,0,0,0,0,0,0,0,0,0,1,0,0,1,0,0,#N/A,#N/A,#N/A,#N/A,#N/A,#N/A,#N/A,#N/A,#N/A,#N/A,#N/A,#N/A,#N/A,#N/A,#N/A,#N/A,#N/A,#N/A,#N/A,#N/A,#N/A,#N/A,#N/A,#N/A,#N/A,#N/A,#N/A,#N/A,#N/A,N,,N,N,Yes,
272,233,POSCO Holdings,Metals,Metals and mining,South Korea,Asia,"$53,869.8",$825.3,-0.365,"$70,040.2",44502,31,N,,,N,N,,,,,,,,,,,Net zero,Net Zero,Yes,Not Specified,No,1,,N,,,,,,Y,1,"POSCO joins in with the Korean government‚Äôs 2050 Carbon Neutrality Declaration
",2050,,,Yes,No,No,N,,,,,,,,0,0,0,0,0,0,0,0,0,0,0,0,0,1,0,0,0,0,0,0,1,1,1,0,0,0,1,1,0,0,0,0,1,1,0,0,0,0,0,0,0,0,0,0,0,0,1,0,1,0,0,1,0,N,0,N,V,U,N,N,,Y,N,Yes,
100,108,PowerChina,Engineering & Construction,Engineering and construction,China,Asia,"$99,829.5",$607,-0.218,"$213,009.2",182299,14,N,,,N,N,,,,,,,,,,,No target,No Target,yes,yes,Not Specified,"1,2",G,N,committed to national peak and neutrality targets,2060,https://www.powerchina.cn/col7440/art/2022/art_7440_1400881.html,,,N,,,,,,Not Specified,Not Specified,No,N,,,,,,,,0,0,0,0,0,0,0,0,0,0,0,0,0,0,0,0,0,0,0,0,0,0,0,0,0,0,0,0,0,1,0,0,0,0,0,0,0,0,0,0,0,0,0,0,0,0,0,0,0,0,0,0,0,N,0,N,G,"Y, g",0,N,,N,N,Not Specified,
147,149,Procter & Gamble,Soaps and Cosmetics,Household and personal products,U.S.,North America,"$84,039","$14,879",0.015,"$122,370",108000,31,N,,,Y,Y,Targets set,1.5°C ,2030,,,,N,Commitment removed,,,Net zero,Net Zero,Yes,Yes,Yes,"1,2,3",,N,,,,,"C,V",Y,"1,2,3","""In September 2021, P&G set a new ambition to achieve net zero greenhouse gas (GHG) emissions across its operations and supply chain, from raw material to retailer, by 2040. P&G also shared a Climate Transition Action Plan which outlines a comprehensive approach to accelerating climate action and the key challenges ahead. In addition to the details of P&G‚Äôs net zero ambition, the Climate Transition Action Plan covers the entire lifecycle emissions of our products and packaging, across supply chain, operations, consumer use of our products, and product end of life. P&G also issued a TCFD aligned report and responded to CDP‚Äôs Climate Survey. """,2040,,,Yes,Yes (nature-based and CCS-based removals),No,N,,,,,,,,0,0,0,0,0,1,0,1,0,0,0,0,0,1,0,0,0,0,0,0,1,1,1,0,0,0,1,1,0,0,1,0,0,1,0,0,1,1,0,1,0,1,0,1,0,1,1,1,1,1,0,1,1,Y,No,V,C,0,Y,Y,Commitment removed,Y,N,Yes,
169,218,Progressive,Insurance: Property and Casualty,Financial services,U.S.,North America,"$75,372","$8,480",1.173,"$105,745",66308,12,N,,,N,N,,,,,,,,,,,Carbon neutral(ity),Carbon Neutral,Yes,Yes,No,"1,2",C,Y,"Our ultimate goal [is to become] carbon neutral (in Scope 1 and 2 emissions) by 2025, with a goal of becoming net-zero in the following decade.",2025,,,,N,,,,,,Not Specified,Not Specified,No,N,,,,,,,,0,0,0,0,0,0,0,0,0,0,0,0,0,0,0,1,0,1,0,0,0,0,1,0,0,0,1,0,0,1,0,1,0,1,0,0,1,1,0,0,0,0,0,0,0,0,1,1,1,1,0,1,0,N,0,C,C,Y,U,N,,N,Y,Not Specified,
192,266,Prudential Financial,Insurance: Life and Health,Financial services,U.S.,North America,"$70,405","$2,727",0.096,"$735,587",37936,31,N,,,Y,N,Commitment removed,,,,,,,,,,,,,,,"1,2",,N,"a partial Scope 1 & 2 emissions reduction target to be net zero by 2050, limited to these core properties, with interim targets to reduce GHG emissions 55% by 2030 and 97% by 2040 from our 2017 baseline year, and to achieve carbon neutrality for these facilities by 2040",2040,,,C,Y,"1,2","a partial Scope 1 & 2 emissions reduction target to be net zero by 2050, limited to these core properties, with interim targets to reduce GHG emissions 55% by 2030 and 97% by 2040 from our 2017 baseline year, and to achieve carbon neutrality for these facilities by 2040",2050,https://s204.q4cdn.com/830623074/files/doc_downloads/2024/v2/Prudential-s-2024-Sustainability-Report.pdf,,Yes,Y,,N,,,,,,,,0,0,0,0,0,0,0,0,0,0,0,0,0,1,0,0,0,0,0,0,1,1,1,0,0,0,1,1,0,0,0,0,1,1,0,0,1,1,0,0,0,0,0,0,0,0,1,0,1,1,0,1,0,N,0,V,C,Y,U,Y,,Y,N,Yes,
136,125,PTT,Petroleum Refining,Oil and gas,Thailand,Asia,"$87,638.5","$2,554.3",-0.207,"$100,490.5",30251,22,N,,,N,N,,,,,,,,,,,Net zero,Net Zero,Yes,Yes,Partial,"1,2",,N,,,,,C,Y,"1,2","""Long-term Targets - PTT: Achieve Carbon Neutrality by 2040 and Net Zero Emissions by 2050 for PTT‚Äôs owned
operations and PTT‚Äôs wholly owned subsidiaries"" (Objectives/Targets, Climate Action, PPT plc corporate website)",2050,,,Yes,Yes (nature-based and CCS-based removals),No,N,,,,,,,,0,0,0,0,0,0,0,0,0,0,0,0,0,1,0,0,0,0,0,0,1,1,1,0,0,0,1,1,0,0,0,0,1,1,0,0,1,1,0,0,0,0,0,0,0,0,1,0,1,1,0,1,0,N,0,C,C,U,Y,N,,Y,N,Yes,
231,242,Publix Super Markets,Food and Drugstores,Retail,U.S.,North America,"$60,177","$4,635",0.066,"$37,601",255000,31,N,,,N,N,,,,,,,,,,,No target,No Target,Yes,Yes,Not Specified,"1,2",,N,,,https://corporate.publix.com/home/newsroom/news%20stories/the%20publix%20green%20routine,no information,,N,,,,,,Not Specified,No,No,N,,,,,,,,0,0,0,0,0,0,0,0,0,0,0,0,0,0,0,0,0,0,0,0,0,0,0,0,0,0,0,0,0,1,0,0,0,0,0,0,0,0,0,0,0,0,0,0,0,0,0,0,0,0,0,0,0,N,0,N,N,0,0,N,,N,N,Not Specified,
419,#N/A,QNB Group,Banks: Commercial and Savings,Financial services,Qatar,Middle East,"$37,472.7","$4,584.8",0.079,"$356,091.2",31000,1,N,,,N,N,,,,,,,,,,,Emissions reduction target,Other Emission Reduction,Yes,Yes,Partial,"1,2",,N,,,,,,N,,,,,,Not Specified,Not Specified,No,Y,"QNB remains committed to protecting the environment through action, and had previously set a target of 20% reduction in GHG (scope 1 and 2) emissions by the end of 2022, based on a 2017 baseline. Our actions and initiatives to date have been to drive towards this target.",2022,,,,,,0,0,0,0,0,0,0,0,0,0,0,0,0,0,0,0,0,0,0,0,0,0,0,1,0,0,0,0,0,1,#N/A,#N/A,#N/A,#N/A,#N/A,#N/A,#N/A,#N/A,#N/A,#N/A,#N/A,#N/A,#N/A,#N/A,#N/A,#N/A,#N/A,#N/A,#N/A,#N/A,#N/A,#N/A,#N/A,#N/A,#N/A,#N/A,#N/A,#N/A,#N/A,N,,N,N,Not Specified,
399,426,Qualcomm,Semiconductors,Technology,U.S.,North America,"$38,962","$10,142",0.402,"$55,154",49000,8,N,,,Y,Y,Targets set,1.5Â°C,2030,Targets set,1.5Â°C,2040,Y,Targets set,2040,,Net zero,Net Zero,Yes,Yes,Yes,"1,2,3",,N,,,,,"C,V",Y,"1,2,3","'To reach net-zero global operational GHG emissions for Scopes 1, 2 and 3 by 2040' (p20) nb 'We also maintain our 2025 GHG reduction goal, consistent with science-based reductions required to keep global warming well below 2¬∞C, to reduce absolute Scope 1 and 2 GHG emissions by 30% compared to a 2014 base year.' (p65)",2040,,,Yes,Not Specified,No,N,,,,,,,,0,0,0,0,0,1,0,1,0,0,1,0,0,1,0,0,0,0,0,0,1,1,1,0,0,0,1,1,0,0,0,0,0,0,0,0,1,1,0,1,0,1,0,0,0,0,1,0,1,1,0,1,0,Y,Yes,V,N,0,Y,Y,Targets set,Y,N,Yes,
348,444,Quanta Computer,Computers,Technology,Taiwan,Asia,"$43,949.6","$1,859.9",0.46,"$28,432.6",65926,20,N,,,Y,Y,Targets set,1.5°C ,2030,Targets set,1.5°C ,2050,Y,Targets set,2050,,Carbon neutral(ity),Carbon Neutral,Yes,Yes,Yes,"1,2,3","C,V",Y,"Our objective is to achieve 50 percent renewable energy by 2030 and carbon neutrality by 2050.  (cf. 2023 ESG report, p. 16) ",2050,,,,N,,,,,,Not Specified,Not Specified,No,N,,,,,,,,0,0,0,0,0,1,0,1,0,0,1,0,0,0,0,0,1,1,0,0,1,1,1,0,0,0,1,0,0,1,0,0,1,1,0,0,0,0,0,1,0,1,0,0,0,0,1,0,1,0,0,1,0,N,Yes,N,C ,U,0,Y,Targets set,N,Y,Not Specified,
453,461,Rabobank Group,Banks: Commercial and Savings,Financial services,Netherlands,Europe,"$35,732.8",$533.9,-0.222,"$205,533.5",58166,4,N,,,N,N,,,,,,,,,,,,,,,,,,N,,,https://www.rabobank.com/about-us/impact/article/011407129/rabobanks-climate-plan-2022-summarized,,,N,,Rabobank engages with clients and business partners that meet or are working towards: • having a plan that captures actions to become 1.5 °C aligned; • capturing and sharing their actual GHG emissions data or alternative information about their progress to become 1.5°C aligned; and • if the client or business partner is required by law or if they are larger clients1 or business partners in the high-emitting sectors defined by the UN’s Net-Zero Banking Alliance (NZBA)2 : having sciencebased carbon emissions reduction targets for 2030 and beyond which are 1.5°C aligned3 .,,Climate-policy-Rabobank-Group.pdf,,Not Specified,,C,Y,"Our Paris Alignment process is focused on delivering on our commitment to transition all operational and attributable GHG emissions from our lending and investment portfolios to align with 1.5°C pathways by mid-century or sooner, including CO2 emissions reaching net-zero at the latest by 2050, consistent with a maximum temperature rise of 1.5°C above pre- industrial levels by 2100. ",2050,,,,,,0,0,0,0,0,0,0,0,0,0,0,0,0,0,0,0,0,0,0,0,0,0,0,0,0,1,0,0,0,1,0,0,0,0,0,0,0,0,0,0,0,0,0,0,0,0,0,0,0,0,0,0,0,N,0,C,C,N,Y,N,,N,N,Not Specified,
333,345,Raizen,Petroleum Refining,Oil and gas,Brazil,Latin America,"$45,473.9",$-758.3,-8.183,"$24,562.3",46000,4,N,,,N,N,,,,,,,,,,,,,,,,,,N,,,https://www.raizen.com.br/en/sustainability/climate-change,no useful information ,,N,,,,,,Not Specified,,,N,,,,,,,,0,0,0,0,0,0,0,0,0,0,0,0,0,0,0,0,0,0,0,0,0,0,0,0,0,0,0,0,0,1,0,0,0,0,0,0,0,0,0,0,0,0,0,0,0,0,0,0,0,0,0,0,0,N,0,N,N,0,0,N,,N,N,Not Specified,
88,86,Reliance Industries,Petroleum Refining,Oil and gas,India,Asia,"$114,121.6","$8,239.3",-0.021,"$228,260.5",381876,22,N,,,N,N,,,,,,,,,,,Net zero,Net Zero,Yes,Yes,Yes,"1,2,3",,N,,,,,"C,V",Y,"1,2,3","RIL continues to make steady progress toward its Net Carbon Zero target by 2035, with a focused approach to reducing operational GHG emissions through energy conservations, renewable energy transition, carbon capture and utilisation, and industrial decarbonisation. To achieve its ambitious Net Carbon Zero target by 2035, Reliance announced plans to: ‚Ä¢ Establish and enable 100 GW of renewable energy by 2030 ‚Ä¢ Invest in the value chain, partnerships and future technologies, including upstream and downstream industries ‚Ä¢ Build giga factories to create and offer a fully integrated, end-to-end renewable energy ecosystem ‚Ä¢ Transform its business to Net Carbon Zero operation",2035,,,Yes,"Yes (CCS-based removals e.g. BECCS, DACCS)",No,N,,,,,,,,0,0,0,0,0,0,0,0,0,0,0,0,0,1,0,0,0,0,0,0,1,1,1,0,0,0,1,1,0,0,0,0,0,0,0,0,1,1,0,0,0,0,0,0,0,0,1,0,1,0,0,1,0,N,0,C,N,0,U,N,,Y,N,Yes,
229,251,Renault,Motor Vehicles & Parts,Automotive,France,Europe,"$60,811.1",$813.2,-0.658,"$133,947",98636,31,N,,,Y,Y,Targets set,Well-below 2Â°C/2Â°C,2030,,,,,,,,Carbon neutral(ity),Carbon Neutral,Yes,Yes,Yes,"1,2,3","C,V",Y,"Following the Paris Climate Agreement (COP 21), Renault Group has adapted its strategy to reduce greenhouse gas emissions from its activities and help limit global warming to well below 2¬∞C and beyond, to continue its efforts to limit the rise in temperatures to 1.5¬∞C. For 2050, Renault Group's ambition is to converge towards net zero carbon emissions over the entire lifecycle worldwide (and as early as 2040 in Europe). (p8)",2050,,,,N,,,,,,Not Specified,Not Specified,No,N,,,,,,,,0,0,0,0,0,1,0,1,0,0,0,0,0,0,0,0,1,1,0,0,0,0,1,0,0,0,1,0,0,1,0,0,0,0,0,0,1,1,0,1,0,1,0,0,0,0,1,0,1,1,0,1,0,Y,No,V,I,0,Y,Y,,N,Y,Not Specified,
260,247,Repsol,Petroleum Refining,Oil and gas,Spain,Europe,"$55,571.5","$1,899",-0.446,"$65,423.5",25601,31,N,,,N,N,,,,,,,,,,,Net zero,Net Zero,Yes,Yes,Yes,"1,2,3",,N,,,,,"C,V",Y,"1,2,3","The main goal is to become a net zero emissions company by 2050, in line with the targets set out in the Paris Agreement.",2050,,,Yes,Yes (nature-based and CCS-based removals),No,N,,,,,,,,0,0,0,0,0,0,0,0,0,0,0,0,0,1,0,0,0,0,0,0,1,1,1,0,0,0,1,1,0,0,0,0,0,0,0,0,1,1,0,0,0,0,0,0,0,0,1,0,1,1,0,1,0,N,0,C + F,N,0,Y,N,,Y,N,Yes,
112,#N/A,REWE Group,Food & Drug Stores,Retail,Germany,Europe,"$95,044.2","$1,057",0.455,"$43,864.6",194956,1,N,,,N,N,,,,,,,,,,,Net zero,Net Zero,Yes,Yes,Yes,"1,2,3",,N,,,,,"C,V",Y,"1,2,3","""Our ambitious goal is to achieve net-zero emissions as a Group by 2050. This applies to all emissions along the entire value chain ‚Äì from our own operations to those of our suppliers and partners. We are aligning our climate targets with the Science Based Targets initiative (SBTi) and the 1.5 ¬∞C target of the Paris Agreement.

For our own company operations (Scope 1 and Scope 2), we aim to achieve climate neutrality by 2040. This includes reducing emissions in our stores, logistics, and administrative buildings as much as possible and offsetting any remaining unavoidable emissions.""",2050,,,Yes,Not Specified,No,N,,,,,,,,0,0,0,0,0,0,0,0,0,0,0,0,0,1,0,0,0,0,0,0,1,1,1,0,0,0,1,1,0,0,#N/A,#N/A,#N/A,#N/A,#N/A,#N/A,#N/A,#N/A,#N/A,#N/A,#N/A,#N/A,#N/A,#N/A,#N/A,#N/A,#N/A,#N/A,#N/A,#N/A,#N/A,#N/A,#N/A,#N/A,#N/A,#N/A,#N/A,#N/A,#N/A,N,,Y,N,Yes,
274,264,Rio Tinto Group,"Mining, Crude-Oil Production",Metals and mining,U.K.,Europe,"$53,658","$11,552",0.149,"$102,786",59594,20,N,,,N,N,,,,,,,,,,,Net zero,Net Zero,Yes,Yes,No,"1,2",,N,,,,,C,Y,"1,2","""We aim to reduce our net Scope 1 and 2 emissions by 50% by 2030 (relative to 2018 levels), and to reach net zero by 2050.""

Source:  2025 Climate Action Plan p. 47
https://web.archive.org/web/20250603175831/https://cdn-rio.dataweavers.io/-/media/content/documents/invest/reports/climate-change-reports/2025-climate-action-plan.pdf?rev=00e9f51ee9b245f8996e9ea288ba8f06",2050,,,Yes,Yes (nature-based and CCS-based removals),No,N,,,,,,,,0,0,0,0,0,0,0,0,0,0,0,0,0,1,0,0,0,0,0,0,1,1,1,0,0,0,1,1,0,0,0,0,0,0,0,0,1,1,0,0,0,0,0,0,0,0,1,0,1,0,0,1,0,N,0,C,N,0,U,N,,Y,N,Yes,
188,197,Roche Group,Pharmaceuticals,Health care and pharmaceuticals,Switzerland,Europe,"$70,861.1","$9,400.1",-0.266,"$112,363.1",103249,31,N,,,Y,Y,Targets set,1.5°C ,2029,Targets set,1.5°C ,2045,Y,Targets set,2045,,Zero emissions,Net Zero,Yes,Yes,Partial,"1,2",,N,,,,,C,Y,"1,2","In October 2024, Roche submitted its greenhouse gas (GHG) reduction targets to the Science Based Targets initiative (SBTi), underscoring its commitment to addressing climate change. As part of its ongoing sustainability efforts, Roche has expanded its carbon reduction strategy to include nearand long-term targets. These targets seek to reduce GHG emissions across its operations (Scope 1 and 2) and throughout its up- and downstream value chain (Scope 3). The goal is to achieve net zero emissions across Roche‚Äôs entire value chain by 2045. SBTi validation of these targets is in progress, targets will be announced once validated. Roche‚Äôs commitment remains to achieve absolute zero Scope 1 and 2 emissions by 2050.

Last year, they refined their company-wide sustainability strategy. In the area of climate protection, they have set a target of achieving net-zero emissions throughout our value chain by 2045 and absolute zero emissions by 2050 as part of the Science Based Targets initiative",2050,,,Not Specified,Yes (unspecified),No,N,,,,,,,,0,0,0,0,0,1,0,1,0,0,1,0,0,1,0,0,0,0,0,0,1,1,1,0,0,0,1,0,0,1,0,0,0,0,0,0,1,1,0,0,0,0,0,0,0,0,1,0,1,0,1,1,0,N,0,C,N,0,N,Y,Targets set,Y,N,Not Specified,
90,89,Rosneft Oil,Petroleum Refining,Oil and gas,Russia,Europe,"$109,254.3","$11,680.8",-0.215,"$182,191.1",333700,19,N,,,N,N,,,,,,,,,,,Carbon neutral(ity),Carbon Neutral,Yes,Yes,No,"1,2",C,Y,"In late 2021, the Company‚Äôs Board of Directors approved the Rosneft-2030: Reliable Energy and Global Energy Transition Strategy comprising a number of ambitious sustainability
goals. The key strategic focus for the Company is to reach carbon neutrality in terms of GHG emissions (Scope 1 and 2) by 2050. We also set relevant targets and KPIs to drive these improvements:
Growing the Company‚Äôs natural gas production to over 100 bcm per annum;
Reducing per unit GHG emissions by 5% by 2022;
Avoiding 8 mmt of –°–û2 equivalent emissions through the Gas Investment Program and the Energy Saving Program;
Achieving a top quartile indicator in GHG emissions‚Äô intensity (Upstream oil and gas production, t CO2 eq. /production, kt) comparable with leading global peers;
Developing and producing new products that allow consumers to reduce emissions through the use of the Company‚Äôs more eco-friendly products.

Source: Carbon Management Plan 2021: https://web.archive.org/web/20241214223743/https://www.rosneft.com/upload/site2/document_file/Rosneft_CSR2021_ENG.pdf UN SDGS Report 2023: https://web.archive.org/web/20250421052601/https://www.rosneft.com/upload/site2/attach/3/23/Rosneft_UN_en_2023.pdf",2050,,,,N,,,,,,Not Specified,Yes (nature-based and CCS-based removals),No,N,,,,,,,,0,0,0,0,0,0,0,0,0,0,0,0,0,0,0,0,1,1,0,0,0,0,1,0,0,0,1,0,0,1,0,0,1,1,0,0,0,0,0,0,0,0,0,0,0,0,1,0,1,1,0,1,0,N,0,N,C,Y,N,N,,N,Y,Not Specified,
108,114,Royal Ahold Delhaize,Food and Drugstores,Retail,Netherlands,Europe,"$96,632.4","$1,907.7",-0.058,"$53,677.8",222000,31,N,,,Y,Y,Targets set,1.5°C ,2030,Targets set,1.5°C ,2050,Y,Targets set,2050,,Net zero,Net Zero,Yes,Yes,Yes,"1,2,3",,N,,,,,"C,V",Y,"1,2,3","Long-term targets: 
For Scope 1 & Scope 2 - Reaching Net Zero by 2040: 90% reduction and 10% removals against the 2018 baseline.

For Scope 3 - Reaching Net Zero by 2050 (2020 baseline, submitted but not yet validated):
- ""We commit to reduce absolute scope 3 FLAG GHG emissions by at least 72% by 2050 from the 2020 SBTi baseline"".
- ""We commit to reduce absolute scope 3 E&I GHG emissions by 90% by 2050 from the 2020 SBTi baseline."" (page 20 of the 2024 report)

In their 2024 report it is mentioned that: ""We plan to reduce electricity emissions to zero by 2035."" (page 34)
",2050,,,Yes,Yes (unspecified),Yes,N,,,,,,,,0,0,0,0,0,1,0,1,0,0,1,0,0,1,0,0,0,0,0,0,1,1,1,0,0,0,1,1,0,0,0,0,0,0,0,0,1,1,0,1,0,1,0,0,0,0,1,0,1,0,0,1,0,Y,Yes,"C, V",N,0,U,Y,Targets set,Y,N,Yes,
101,137,Royal Bank of Canada,Megabanks,Financial services,Canada,North America,"$98,742.8","$11,929.2",0.083,"$1,557,918.1",94838,31,N,,,N,N,,,,,,,,,,,Net zero,Net Zero,Yes,Yes,Partial,"1,2",,N,,,,,C,Y,"1,2","""RBC has a goal to achieve net-zero in our lending by 2050."" (Pg 5, RBC Climate Report 2023) [https://www.rbc.com/community-sustainability/_assets-custom/pdf/climate-report-2023.pdf]",2050,,,Yes,Not Specified,No,N,,,,,,,,0,0,0,0,0,0,0,0,0,0,0,0,0,1,0,0,0,0,0,0,1,1,1,0,0,0,1,1,0,0,1,0,0,1,0,0,1,1,0,0,0,0,0,0,0,0,1,1,1,1,0,1,1,N,0,F,C,Y,Y,N,,Y,N,Yes,
153,188,RTX,Aerospace and Defense,Aerospace and defense,U.S.,North America,"$80,738","$4,774",0.494,"$162,861",186000,31,N,,,N,N,,,,,,,,,,,Emissions reduction target,Other Emission Reduction,Yes,Yes,Not Specified,"1,2",,N,,,,,,N,,,,,,Not Specified,Not Specified,No,Y,"'By 2050 we aspire to...Partner to achieve industrywide net-zero carbon emissions in civil aviation. To support the industry‚Äôs goals, we aim to directly address 30% of air transport carbon dioxide (CO2) emissions through the engines, aircraft systems and services in our 2050 civil fleet, relative to 2015 technology levels and the associated emissions baseline.' [emissions reduction target is a part of the industry net zero target, but it doesn't seem like Raytheon Technologies themselves will achieve net zero individually].  (p. 5, 2022 ESG report)",2050,,,,,,0,0,0,0,0,0,0,0,0,0,0,0,0,0,0,0,0,0,0,0,0,0,0,0,0,1,0,0,0,1,0,0,0,0,0,0,1,1,0,0,0,0,0,0,0,0,1,0,1,1,0,1,0,N,0,C,N,0,Y,N,,N,N,Not Specified,
393,415,S.F. Holding,Air Freight and Logistics,Transportation and logistics,China,Asia,"$39,529.4","$1,413.5",0.215,"$29,293.8",147189,4,N,,,Y,Y,Targets set,1.5°C ,2030,Targets set,1.5°C ,2050,Y,Targets set,2050,,Net zero,Net Zero,Yes,Yes,Yes,"1,2,3",,N,,,,,"C,V",Y,"1,2,3","In November 2023, SF officially signed and submitted the Business Ambition for 1.5°C  Commitment Letter to the ‚ÄúScience-Based Carbon Target Initiative‚Äù (SBTi), demonstrating the company‚Äôs commitment to achieving science-based greenhouse gas emission reduction targets and striving to achieve net-zero emissions in the value chain by 2050.' (P.74, 2024 Sustainability Report) 
""Overall Net-Zero Target: S.F. Holding Co., Ltd commits to reach net-zero greenhouse gas emissions across the value chain by 2050."" (SBTi target dashboard)",2050,,,Yes,"Yes (nature-based removals e.g. Forestation, soil carbon enhancement)",No,N,,,,,,,,0,0,0,0,0,1,0,1,0,0,1,0,0,1,0,0,0,0,0,0,1,1,1,0,0,0,1,1,0,0,0,0,0,0,0,0,0,0,0,1,0,1,0,0,0,0,0,0,0,0,0,1,0,N,Yes,N,G,U,0,Y,Targets set,Y,N,Yes,
138,93,SAIC Motor,Motor Vehicles & Parts,Automotive,China,Asia,"$87,223.9",$231.6,-0.884,"$131,128.1",134323,14,N,,,N,N,,,,,,,,,,,Other,Other Emission Reduction,Yes,Yes,No,"1,2",,N,,,,,,N,,,,,,Not Specified,Not Specified,No,Y,"'During the reporting period, SAIC Motor established ambitious emission reduction targets based on the Company's development strategy, which is striving to achieve high-quality ""Carbon Peaking"" by 2025.'
",2025,,,,,,0,0,0,0,0,0,0,0,0,0,0,0,0,0,0,0,0,0,0,0,0,0,0,0,1,0,0,0,0,1,0,0,0,0,0,0,0,0,0,0,0,0,0,0,0,0,0,0,0,0,0,0,0,N,0,N,G,"Y, g",0,N,,N,N,Not Specified,
302,284,Saint-Gobain,"Building Materials, Glass",Industrial goods,France,Europe,"$50,363.4","$3,075.6",0.054,"$63,903.5",158413,31,N,,,Y,Y,Targets set,1.5°C ,2030,Targets set,1.5°C ,2050,Y,Targets set,2050,,Net zero,Net Zero,Yes,Yes,Yes,"1,2,3",,N,,,,,"C,V",Y,"1,2,3","Saint-Gobain commits to reduce absolute scope 1 and 2 GHG emissions 33% by 2030 from a 2017 base year. Saint-Gobain also commits to reduce absolute scope 3 GHG emissions ‚Ä¶ 16% within the same timeframe. Saint-Gobain further commits to reduce absolute scope 1, 2 and 3 GHG emissions 90% by 2050 from a 2017 base year.",2050,,,Yes,Yes (unspecified),No,N,,,,,,,,0,0,0,0,0,1,0,1,0,0,1,0,0,1,0,0,0,0,0,0,1,1,1,0,0,0,1,1,0,0,0,0,1,1,0,0,1,1,0,1,0,1,0,0,0,0,1,0,1,0,0,1,0,Y,Yes,V,V,U,U,Y,Targets set,Y,N,Yes,
411,445,Salesforce,Computer Software,Technology,U.S.,North America,"$37,895","$6,197",0.498,"$102,928",76453,3,N,,,Y,Y,Targets set,1.5°C ,2031,Targets set,1.5°C ,2041,Y,Targets set,2041,,Net zero,Net Zero,Yes,Yes,Yes,"1,2,3",,N,,,,,"C,V",Y,"1,2,3","""Salesforce global climate policy principal: Reduce emission sources and scale nature-based solutions to reach net-zero emissions by 2050"" (FY25 Stakeholder Impact Report Summary, p. 23).
Source: https://web.archive.org/web/20251019160559/https://www.salesforce.com/en-us/wp-content/uploads/sites/4/documents/white-papers/salesforce-fy25-stakeholder-impact-report.pdf",2050,,,Yes,Not Specified,Yes,N,,,,,,,,0,0,0,0,0,0,1,1,0,0,1,0,0,1,0,0,0,0,0,0,1,1,1,0,0,0,1,1,0,0,0,0,0,0,1,0,0,1,0,1,0,1,0,0,0,0,1,1,1,1,0,1,1,Y,No,"C,V",N,0,Y,Y,Targets set,Y,N,Yes,
