Profile (FG500),,,Details (FG500),,,,,,,,,,RE100,,,SBTi,,,,,,,,,,,,NZ Tracker Definition,,,,,,Carbon Neutral,,,,,,Net Zero,,,,,,,Use of carbon credits,,Other reduction targets,,,,,,Other,,,Binary,,,,,,,,,,,,,,,,,,,,,,,,,,,,,,,,,,,,,,,,,,,,,,,,,,,,,,,,,,,,,,,,
,,,,,,,,,,,,,,,,,,,,,,,,,,,,,,,,,,,,,,,,,,,,,,,,,,,,,,,,,,,,,,,,,,,,,,,,,,,,,,,,,,,,,,,,2024 Data,2024 Data,2024 Data,2024 Data,2024 Data,2024 Data,2024 Data,2024 Data,2024 Data,2024 Data,2024 Data,2024 Data,2024 Data,2024 Data,2024 Data,2024 Data,2024 Data,2024 Data,2024 Data,2024 Data,2024 Data,2024 Data,2024 Data,Last year checks ,,,,,,this year  ,,,,,
2025 Rank,2024 rank,Company name,Sector (Fortune),Sector (final classification),Country,Region,Revenue ($M) usable,Profits ($M) usable,Profits (% change),Assets ($M),Employees,Years on list (2025),RE100 (Y/N),Joining year,Target year,In SBTI database?,"Near Term SBT (Y = yes, N=no)","Target status (T = target set, C = committed, N=No, R=Removed)",Target classification (near term) - temp,Target year (near term) (earlier of the two dates if there were two) ,Long term - Target Status,Long term - Target Classification,Long term - Target Year,"Net zero committed (SBTi) (Y = yes, N = no)",SBTi NZ Target Status,Net zero Target year (SBTi),notes,NZ Tracker_End target (in their words),NZ Tracker Target Grouping,Scope 1,Scope 2,Scope 3,"Carbon neutral scope(s) - Scope 1,2,3 (NZ Tracker)","Carbon neutral commitment (C = company, V = value chain, G= Government, S=Subsidiary,  U = unspecified, N=no)",CN (Y/N),Carbon neutral claim (in their words),Target year,Source,Notes (including climate positive),"Net zero commitment (V = value chain, C = company,  U = unclear, S=Subsidiary)",NZ (Y/N),Primary net zero scope (in their words),Primary net zero claim (in their words),Net zero target year,Source,Notes,"Carbon credits (Y = yes, N = no, R = removals only, U = unclear).1",Removals,Separate Removal Target,"Other reduction target (Y = yes) (either companies w/ no SBT or w/ SBT ""C"")",Target details (Text),Target Year,Source,Notes,Who did it?,When?,Oher Sources,RE100 <=2024,RE100 2025-2030,RE100>2030,All RE,SBTi ST <= 2024,SBTi ST 2025-2030,SBTi ST > 2030,All SBTi ST,SBTi NZ <= 2024,SBTi NZ 2025-2030,SBTi NZ > 2030,Other NZ <= 2024,Other NZ 2025-2030,Other NZ > 2030,CN <= 2024,CN 2025-2030,CN > 2030,All CN,Total NZ <=2024,Total NZ 2025-2030,Total NZ > 2030,All NZ,CN/NZ,Other Emission Reduction <=2024,Other Emission Reduction 2025-2030,Other Emission Reduction > 2030,One of the actions,Carbon Credits (Y),Carbon Credits (No),Carbon Credits (Not Specified),CN already achieved ,CN 2024-2030,CN 2031-2050,Any CN,NZ already achieved,NZ 2024-2030,NZ 2031-2050,Any NZ,SBT already achieved,SBT 2024-2030,SBT 2031-2050,Any SBT,RE100 already achieved,RE100 2024-2030,RE100 2031-2050,Any RE100,CN/NZ - IF THE COMPANY HAS A Ccn or nz target,CN/NZ 2030,CN/NZ 2050,will use cabon credits,will NOT use carbon credits,any target,any target already achived,sbti,nz-sbti,nz,cn,cn-cc,nz-cc,sbti,nz-sbti,nz,cn,cn-cc,nz-cc
492,498,ABB,Industrial Machinery,Industrial goods,Switzerland,Europe,"$32,850","$3,935",0.051,"$40,357",109900,30,Y,2021,2030,Y,Y,Targets set,1.5°C ,2030,Targets set,1.5°C ,2050,Y,Targets set,2050,,Net zero,Net Zero,Yes,Yes,Yes,"1,2,3",,N,,,,,"C,V",Y,"1,2,3","""We chose the ‚ÄúNet Zero Emissions by 2050‚Äù scenario of the International Energy Agency (IEA) as the basis for the transition scenario analysis as it features net zero CO2 energy sector and industrial process emissions in 2050, while achieving universal energy access in 2030."" (pg. 29)
",2050,,,Not Specified,Not Specified,No,N,,,,,,,,0,1,0,1,0,1,0,1,0,0,1,0,0,1,0,0,0,0,0,0,1,1,1,0,0,0,1,0,0,1,0,0,0,0,0,0,1,1,0,1,0,1,0,1,0,1,1,0,1,1,0,1,0,Y,Yes,V,N,0,R,Y,Targets set,Y,N,Not Specified,
372,376,Abbott Laboratories,Medical Products and Equipment,Health care and pharmaceuticals,U.S.,North America,"$41,950","$13,402",1.342,"$81,414",114000,27,N,,,N,N,,,,,,,,,,,Emissions reduction target,Other Emission Reduction,Yes,Yes,No,"1,2",,N,,,,,,N,,,,,,Not Specified,No,No,Y,"‚Ä¢ Reduce absolute Scope 1 and 2 carbon emissions by 30% from 2018 baseline by the end of 2030, consistent with the objectives of the Science Based Targets initiative (SBTi). 
‚Ä¢ In 2023, 7% absolute reduction in Scope 1 and 2 emissions in 2023 (versus 2018 baseline); the emissions production decreased by 1% compared with 2022.
‚Ä¢ In 2023, a dedicated environmental sustainability capital fund of $15 million annually was established to support the completion of priority energy efficiency projects.

(Sources: Abbott 2030 Sustainability Plan and Global Sustainability Report 2023)",2030,,,,,,0,0,0,0,0,0,0,0,0,0,0,0,0,0,0,0,0,0,0,0,0,0,0,0,1,0,0,0,0,1,0,0,0,0,0,0,0,0,0,1,0,1,0,0,0,0,0,0,0,0,0,1,0,Y,No,N,N,0,0,N,,N,N,Not Specified,
249,259,AbbVie,Pharmaceuticals,Health care and pharmaceuticals,U.S.,North America,"$56,334","$4,278",-0.12,"$135,161",55000,10,N,,,Y,Y,Targets set,1.5°C ,2030,,,,,,,,Emissions reduction target,Other Emission Reduction,Yes,Yes,No,"1,2",,N,,,,,,N,,,,,,Not Specified,Not Specified,No,Y,"(p.12) Emissions: Reduce absolute Scope 1 and 2 (market-based) GHG emissions by 42.0% by 2030 from a 2021 base year

Website: https://www.abbvie.com/content/dam/abbvie-com2/pdfs/abbvie-esg-action-report.pdf",2030,,,,,,0,0,0,0,0,1,0,1,0,0,0,0,0,0,0,0,0,0,0,0,0,0,0,0,1,0,1,0,0,1,0,0,0,0,0,0,1,1,0,1,0,1,0,0,0,0,1,0,1,1,0,1,0,Y,No,C,N,0,Y,Y,,N,N,Not Specified,
211,211,Accenture,Information Technology Services,Technology,Ireland,Europe,"$64,896.5","$7,264.8",0.057,"$55,932.4",774303,24,Y,2019,2023,Y,Y,Targets set,1.5°C ,2030,Targets set,1.5°C ,2040,Y,Targets set,2040,,Net zero,Net Zero,Yes,Yes,Yes,"1,2,3",,N,,,,,"C,V",Y,"1,2,3","""We continue to work toward our 2025 carbon removal goal by first focusing on reductions across our Scope 1, 2 and 3 emissions and then removing any remaining emissions through nature-based carbon removal projects."" (P.43, 360¬∞ Value Report 2024)",2025,,,Not Specified,"Yes (nature-based removals e.g. Forestation, soil carbon enhancement)",No,N,,,,,,,,1,0,0,1,0,1,0,1,0,0,1,0,1,0,0,0,0,0,0,1,1,1,1,0,0,0,1,0,0,1,0,0,0,0,0,0,1,1,0,1,0,1,1,0,0,1,1,1,1,1,0,1,1,Y,Yes,V,N,0,Y,Y,Targets set,Y,N,Not Specified,
337,391,ACS,Engineering & Construction,Engineering and construction,Spain,Europe,"$45,023.4",$895,0.061,"$43,513.4",157284,21,N,,,N,N,,,,,,,,,,,Emissions reduction target,Other Emission Reduction,Yes,Yes,No,"1,2",,N,,,,,"C,V",Y,,"This is to meet the targets that the ACS Group has set for itself, and to make good on its commitment in its 2025 Strategic Sustainability Plan to achieve the target of zero net emissions by 2045.",2045,https://www.grupoacs.com/ficheros_editor/File/03_accionistas_inversores/06_junta_general_accionistas/2025/05.%20Informaci%C3%B3n%20no%20financiera_ENG.pdf?utm_source=chatgpt.com,,Yes,"Yes (nature-based removals e.g. Forestation, soil carbon enhancement)",No,Y,"Reduction of scope 1 emissions by 35% in 2030, with an intermediate reduction target of at least 15% by 2025 

Reduction of scope 2 emissions by 60% in 2030, with an intermediate reduction target of at least 30% by 2025",2030,,,,,,0,0,0,0,0,0,0,0,0,0,0,0,0,1,0,0,0,0,0,0,1,1,1,0,1,0,1,1,0,0,0,0,1,1,0,0,0,0,0,0,0,0,0,0,0,0,1,0,1,0,0,1,0,N,0,N,C,U,0,N,,Y,N,Yes,
207,203,AEON,Food & Drug Stores,Retail,Japan,Asia,"$66,457.7",$188.7,-0.395,"$91,812",392001,31,Y,2018,2030,Y,Y,Targets set,1.5°C ,2030,,,,N,Commitment removed,,,Zero emissions,Net Zero,Yes,Yes,Yes,"1,2,3",,N,,,,,"C,V",Y,"1,2,3",Reduce total CO2 and other emissions from stores to net-zero by 2040 ,2040,,,Not Specified,Not Specified,No,N,,,,,,,,0,1,0,1,0,1,0,1,0,0,0,0,0,1,0,0,0,0,0,0,1,1,1,0,0,0,1,0,0,1,0,0,0,0,0,0,1,1,0,1,0,1,0,1,0,1,1,0,1,1,0,1,0,Y,Yes,C,N,0,Y,Y,Commitment removed,Y,N,Not Specified,
30,34,Agricultural Bank of China,Banks: Commercial and Savings,Financial services,China,Asia,"$197,466.4","$39,204.6",0.03,"$5,923,600.2",454716,26,N,,,N,N,,,,,,,,,,,No target,No Target,yes,yes,No,"1,2",G,N,committed to national peak and neutrality targets,2060,https://finance.sina.com.cn/stock/relnews/cn/2025-04-08/doc-inesmepe5162164.shtml,,,N,,,,,,No,No,No,Y,emission reduction ,,https://ditchcarbon.com/organizations/agricultural-bank-of-china,,,,,0,0,0,0,0,0,0,0,0,0,0,0,0,0,0,0,0,0,0,0,0,0,0,0,0,1,0,0,1,0,0,0,0,0,0,0,0,0,0,0,0,0,0,0,0,0,0,0,0,0,0,0,0,N,0,N,G,"Y, g",0,N,,N,N,No,
417,446,AIA Group,"Insurance: Life, Health (stock)",Financial services,China,Asia,"$37,612","$6,836",0.816,"$305,454",27421,10,N,,,Y,Y,Targets set,1.5°C ,2025,,,,,,,,Net zero,Net Zero,Yes,Yes,No,"1,2",,N,,,,,C,Y,"1,2","'In 2021, we became one of the largest life and health insurers in the world to commit to achieving net-zero greenhouse gas (GHG) emissions by 2050' (p7)",2050,,,Not Specified,Not Specified,No,N,,,,,,,,0,0,0,0,0,1,0,1,0,0,0,0,0,1,0,0,0,0,0,0,1,1,1,0,0,0,1,0,0,1,0,0,0,0,0,0,1,1,0,1,0,1,0,0,0,0,1,0,1,0,0,1,0,Y,No,C,N,0,U,Y,,Y,N,Not Specified,
474,496,Air France-KLM Group,Airlines,Transportation and logistics,France,Europe,"$33,996.7",$322.7,-0.716,"$326,031.2",42511,30,N,,,Y,Y,Targets set,Well-below 2¬∞C,2030,,,,,,,,Net zero,Net Zero,Yes,Yes,Yes,"1,2,3",,N,,,,,"C,V",Y,"1,2,3","Air France ‚Äì KLM has a strong commitment towards sustainability, including reaching Net Zero carbon emissions in 2050 by activating, among others, levers on operations, fleet renewal and Sustainable Aviation Fuel.",2050,,,Yes,Yes (unspecified),No,N,,,,,,,,0,0,0,0,0,1,0,1,0,0,0,0,0,1,0,0,0,0,0,0,1,1,1,0,0,0,1,1,0,0,0,0,0,0,0,0,1,1,0,1,0,1,0,0,0,0,1,0,1,0,0,1,0,Y,No,C  ,N,0,U,Y,,Y,N,Yes,
174,183,Airbus,Aerospace and Defense,Aerospace and defense,Netherlands,Europe,"$74,867.5","$4,576.6",0.117,"$133,788.6",156921,31,N,,,Y,Y,Targets set,1.5°C ,2035,,,,,,,,Emissions reduction target,Other Emission Reduction,Yes,Yes,No,"1,2",,N,,,,,,N,,,,,,Yes,Not Specified,No,Y,-63%(2) in line with 1.5°C  pathway ‚Äúnet zero Scope 1&2‚Äù by 2030'  (p61),2030,,,,,,0,0,0,0,0,0,1,1,0,0,0,0,0,0,0,0,0,0,0,0,0,0,0,0,1,0,1,1,0,0,0,0,0,0,0,0,1,1,0,1,0,1,0,0,0,0,1,0,1,1,0,1,0,Y,No,C,N,0,Y,Y,,N,N,Yes,
154,152,Albertsons,Food & Drug Stores,Retail,U.S.,North America,"$80,390.9",$958.6,-0.26,"$26,755.7",196650,21,N,,,Y,Y,Targets set,1.5°C ,2030,,,,,,,,,,,,,,,N,,,https://www.albertsonsmediacollective.com/pr-details/2022/Albertsons-Companies-Announces-ESG-Goals-and-Long-Term-Strategies-to-Support-a-More-Sustainable-Future/default.aspx,,C,Y,"1,2",Achieve Net Zero emissions in company operations by 2040.,2040,https://www.albertsonsmediacollective.com/pr-details/2022/Albertsons-Companies-Announces-ESG-Goals-and-Long-Term-Strategies-to-Support-a-More-Sustainable-Future/default.aspx,,Not Specified,,,N,,,,,,,,0,0,0,0,0,1,0,1,0,0,0,0,0,1,0,0,0,0,0,0,1,1,1,0,0,0,1,0,0,1,0,0,0,0,0,0,1,1,0,1,0,1,0,0,0,0,1,0,1,1,0,1,0,Y,No,C,N,0,Y,Y,,Y,N,Not Specified,
63,70,Alibaba Group Holding,Internet Services and Retailing,Retail,China,Asia,"$138,065","$18,029.4",0.615,"$248,629.1",124320,9,N,,,Y,N,Commitment removed,,,,,,N,Commitment removed,,,Carbon neutral(ity),Carbon Neutral,Yes,Yes,Yes,"1,2,3","C,V",Y,"In 2021, we set the goals of: (1) achieving carbon neutrality in our own operations by 2030; (2) halving the net emissions intensity in the value chain by 2030 (cf. 2024 Alibaba Group ESG Report, p. 9) Baseline year - Jan 2020 - Dec 2020 (cf. 2024 Alibaba Group ESG Report, p. 27). ",2030,,,,N,Achieve Net Zero emissions in company operations by 2040.,Engage top suppliers to set science-based carbon reduction targets by 2026.,,,,Not Specified,Yes (nature-based and CCS-based removals),No,N,,,,,,,,0,0,0,0,0,0,0,0,0,0,0,0,0,0,0,1,0,1,0,0,0,0,1,0,0,0,1,0,0,1,0,1,0,1,0,0,0,0,0,1,0,1,0,0,0,0,1,1,1,1,0,1,0,N,Yes,N,C,Y,0,Y,Commitment removed,N,Y,Not Specified,
195,177,Alimentation Couche-Tard,Specialty Retailers,Retail,Canada,North America,"$69,263.5","$2,729.7",-0.117,"$36,942.1",149000,12,N,,,N,N,,,,,,,,,,,Carbon neutral(ity),Carbon Neutral,Yes,Yes,No,"1,2",C,Y,"2024 sustainability report, p 49: Carbon neutral for Scope 1 and 2 net emissions from energy consumption including the use of carbon credits. ",2030,,,,N,Achieve Net Zero emissions in company operations by 2040.,,,,,Not Specified,Yes (unspecified),No,N,,,,,,,,0,0,0,0,0,0,0,0,0,0,0,0,0,0,0,1,0,1,0,0,0,0,1,0,0,0,1,0,0,1,0,1,0,1,0,0,0,0,0,0,0,0,0,0,0,0,1,1,1,1,0,1,0,N,0,N,C,Y,0,N,,N,Y,Not Specified,
76,82,Allianz,"Insurance: Life, Health (stock)",Financial services,Germany,Europe,"$123,148.1","$10,739.7",0.163,"$1,081,567.6",156626,31,Y,2018,2023,Y,N,Commitment removed,,,,,,,,,,Net zero,Net Zero,Yes,Yes,Yes,"1,2,3",,N,,,,,"C,V",Y,"1,2,3",,2050,,,Yes,Yes (nature-based and CCS-based removals),No,N,,,,,,,,1,0,0,1,0,0,0,0,0,0,0,0,0,1,0,0,0,0,0,0,1,1,1,0,0,0,1,1,0,0,1,0,0,1,0,0,1,1,0,0,0,0,1,0,0,1,1,1,1,1,0,1,1,N,0,V,N,Y,R,Y,,Y,N,Yes,
218,244,Allstate,Insurance: Property and Casualty,Financial services,U.S.,North America,"$64,106","$4,667",0,"$111,617",55200,30,N,,,N,N,,,,,,,,,,,Net zero,Net Zero,Yes,Yes,No,"1,2",,N,,,,,C,Y,"1,2","As a service company, Allstate‚Äôs operational greenhouse gas emissions are relatively small compared to the size and scope of our business. We committed to reduce Scope 1 and 2 emissions to zero by 2030 since this will increase efficiency and supports engagement to mitigate the impact of severe weather on customers.",2030,,,Not Specified,Not Specified,No,N,,,,,,,,0,0,0,0,0,0,0,0,0,0,0,0,1,0,0,0,0,0,0,1,0,1,1,0,0,0,1,0,0,1,0,0,0,0,0,1,0,1,0,0,0,0,0,0,0,0,1,1,1,0,0,1,0,N,0,C,N,0,U,N,,Y,N,Not Specified,
13,17,Alphabet,Internet Services and Retailing,Retail,U.S.,North America,"$350,018","$100,118",0.357,"$450,256",183323,17,N,,,Y,Y,Targets set,1.5°C ,2030,,,,,,,,Net zero,Net Zero,Yes,Yes,Yes,"1,2,3",,N,,,,,"C,V",Y,"1,2,3","We aim to run on 24/7 carbon-free energy on every grid where we operate by 2030. 

Reduce 50% of our combined Scope 1, 2 (market-based), and 3 absolute emissions (versus our 2019 baseline) before 2030",2030,,,No,Yes (nature-based and CCS-based removals),Yes,N,,,,,,,,0,0,0,0,0,1,0,1,0,0,0,0,1,0,0,0,0,0,0,1,0,1,1,0,0,0,1,0,1,0,0,0,0,0,0,1,0,1,0,1,0,1,0,0,0,0,1,0,1,1,0,1,0,N,No,V,N,0,Y,Y,,Y,N,No,
203,214,Aluminum Corp. of China,Metals,Metals and mining,China,Asia,"$66,811.1","$1,326.8",0.514,"$83,626.6",122340,18,N,,,N,N,,,,,,,,,,,Carbon neutral(ity),Carbon Neutral,Not Specified,Not Specified,Not Specified,,G,N,,,,,,N,,,,,,Not Specified,Not Specified,No,N,,,,,,,,0,0,0,0,0,0,0,0,0,0,0,0,0,0,0,0,0,0,0,0,0,0,0,0,0,0,0,0,0,1,0,0,0,0,0,0,0,0,0,0,0,0,0,0,0,0,0,0,0,0,0,0,0,N,0,N,G,U,0,N,,N,N,Not Specified,
2,2,Amazon,Internet Services and Retailing,Retail,U.S.,North America,"$637,959","$59,248",0.947,"$624,894",1556000,17,N,,,Y,N,Commitment removed,,,,,,,,,,Net zero,Net Zero,Not Specified,Not Specified,Partial,,,N,,,,,,Y,,"In 2019, we co-founded and committed to The Climate Pledge‚Äîour goal to reach net-zero carbon emissions by 2040, 10 years ahead of the Paris Agreement. (sustainability report 2024 p. 6)
",2040,,,Yes,"Yes (nature-based removals e.g. Forestation, soil carbon enhancement)",No,N,,,,,,,,0,0,0,0,0,0,0,0,0,0,0,0,0,1,0,0,0,0,0,0,1,1,1,0,0,0,1,1,0,0,0,0,0,0,0,0,1,1,0,0,0,0,0,0,0,0,1,0,1,1,0,1,0,N,No,C,N,0,Y,Y,,Y,N,Yes,
321,328,America Movil,Telecommunications,Telecommunications and media,Mexico,Latin America,"$47,484.7","$1,251.1",-0.709,"$86,233.8",178468,19,N,,,N,N,,,,,,,,Commitment removed,,,,,,,,,,N,,,,,,Y,,,2050,Sustainability-Report-2024.pdf,"· Net-zero commitment, by setting a public goal to reach net-zero emissions by no later than 2050,",Not Specified,,,N,,,,,,,,0,0,0,0,0,0,0,0,0,0,0,0,0,1,0,0,0,0,0,0,1,1,1,0,0,0,1,0,0,1,0,0,0,0,0,0,0,0,0,1,0,1,0,0,0,0,0,0,0,0,0,1,0,Y,No,N,N,0,0,N,Commitment removed,Y,N,Not Specified,
268,278,American Airlines Group,Airlines,Transportation and logistics,U.S.,North America,"$54,211",$846,0.029,"$61,783",133300,30,N,,,Y,Y,Targets set,Well-below 2¬∞C,2035,,,,,,,,Net zero,Net Zero,Yes,Yes,Partial,"1,2",,N,,,,,C,Y,"1,2",Target net zero emissions by 2050 (P.13),2050,,,Yes,Not Specified,No,N,,,,,,,,0,0,0,0,0,0,1,1,0,0,0,0,0,1,0,0,0,0,0,0,1,1,1,0,0,0,1,1,0,0,0,0,0,0,0,0,1,1,0,0,1,1,0,0,0,0,1,0,1,1,0,1,0,Y,No,C,N,0,Y,Y,,Y,N,Yes,
175,195,American Express,Consumer Credit Card and Related Services,Financial services,U.S.,North America,"$74,201","$10,129",0.21,"$271,461",75100,31,Y,2020,2025,Y,Y,Targets set,1.5°C ,2033,Targets set,1.5°C ,2050,Y,Targets set,2050,,Net zero,Net Zero,Yes,Yes,Partial,"1,2",,N,,,,achieved,C,Y,"1,2","‚ÄúCommitted to net-zero emissions by 2035 in alignment with the SBTi‚Äù (2021-2022 ESG Report, P.40)",2035,,,Yes,Not Specified,No,N,,,,,,,,0,1,0,1,0,0,1,1,0,0,1,0,0,1,0,0,0,0,0,0,1,1,1,0,0,0,1,1,0,0,1,0,0,1,0,0,1,1,0,1,0,1,0,1,0,1,1,1,1,1,0,1,1,N,No,V,C,Y,U,Y,Targets set,Y,N,Yes,
482,#N/A,Amgen,Pharmaceuticals,Health care and pharmaceuticals,U.S.,North America,"$36,189",$647.8,-0.207,"$15,838.7",139907,2,N,,,Y,Y,Targets set,1.5°C ,2030,,,,,,,,Carbon neutral(ity),Carbon Neutral,Yes,Yes,Yes,"1,2,3","C,V",Y,"""Amgen's 2027 carbon emissions targets have been approved by the Science Based Targets initiative (SBTi) and are consistent with the goal of limiting global warming to 1.5 degrees Celsius for Scope 1 and 2 emissions. We also established an SBTi Scope 3 supplier engagement target to engage with 73% of our suppliers by spend in key categories to support their adoption of science-based carbon reduction targets by 2027. """,2027,,,,N,,,,,,Not Specified,Yes (unspecified),No,N,,,,,,,,0,0,0,0,0,1,0,1,0,0,0,0,0,0,0,1,0,1,0,0,0,0,1,0,0,0,1,0,0,1,#N/A,#N/A,#N/A,#N/A,#N/A,#N/A,#N/A,#N/A,#N/A,#N/A,#N/A,#N/A,#N/A,#N/A,#N/A,#N/A,#N/A,#N/A,#N/A,#N/A,#N/A,#N/A,#N/A,#N/A,#N/A,#N/A,#N/A,#N/A,#N/A,Y,,N,Y,Not Specified,
232,231,Anheuser-Busch InBev,Beverages,"Food, beverages and agriculture",Belgium,Europe,"$59,768","$5,855",0.096,"$206,637",143885,20,Y,2017,2025,Y,Y,Targets set,1.5Â°C,2025,,,,N,Commitment removed,,,Net zero,Net Zero,Yes,Yes,Yes,"1,2,3",,N,,,,,"C,V",Y,"1,2,3","""achieve net zero across our value chain by 2040""

",2040,,,Not Specified,"Yes (nature-based removals e.g. Forestation, soil carbon enhancement)",No,N,,,,,,,,0,1,0,1,0,1,0,1,0,0,0,0,0,1,0,0,0,0,0,0,1,1,1,0,0,0,1,0,0,1,0,0,0,0,0,0,1,1,0,1,0,1,0,1,0,1,1,0,1,1,0,1,0,N,0,V,N,0,Y,Y,Commitment removed,Y,N,Not Specified,
438,371,Ansteel Group,Metals,Metals and mining,China,Asia,"$36,270.6","$-1,382.2",0,"$69,392.9",128584,12,N,,,N,N,,,,,,,,,,,,,,,,,G,N,carbon neutrality,2060,http://en.ansteel.cn/upload/pdf/2021.pdf,info from previous yr database,,N,,,,,,Not Specified,,,N,,,,,,,,0,0,0,0,0,0,0,0,0,0,0,0,0,0,0,0,0,0,0,0,0,0,0,0,0,0,0,0,0,1,0,0,0,0,0,0,0,0,0,0,0,0,0,0,0,0,0,0,0,0,0,0,0,N,0,N,G,U,0,N,,N,N,Not Specified,
356,323,ANZ Group Holdings,Banks: Commercial and Savings,Financial services,Australia,Oceania,"$42,962.8","$4,348.2",-0.08,"$852,221.4",42370,18,Y,2019,2025,N,N,,,,,,,,,,,Emissions reduction target,Other Emission Reduction,Yes,Yes,Yes,"1,2,3",,N,,,,,,N,,,,,,Yes,Not Specified,No,Y,"""2024 Target: Reducing combined scope 1 and 2 emissions 85% by 2025 and 90% by 2030 (against 2015 baseline) - No change for 2025"" (P.20, ANZ 2024 ESG Supplement)",2030,,,,,,0,1,0,1,0,0,0,0,0,0,0,0,0,0,0,0,0,0,0,0,0,0,0,0,1,0,1,1,0,0,0,0,0,0,0,0,1,1,0,0,0,0,0,1,0,1,1,0,1,0,0,1,0,N,0,C,N,0,U,N,,N,N,Yes,
8,7,Apple,Computers,Technology,U.S.,North America,"$391,035","$93,736",-0.034,"$364,980",164000,23,Y,2016,2021,Y,Y,Targets set,1.5°C ,2030,,,,,,,,Carbon neutral(ity),Carbon Neutral,Yes,Yes,Yes,"1,2,3","C,V",Y,"We‚Äôre committed to our ambitious, sciencebased Apple 2030 goal to reduce our collective scope 1, 2, and 3 emissions ‚ upstream and downstream ‚ by 75 percent
before balancing the remaining emissions with high-quality carbon removals. To achieve this goal, we're reducing emissions across our value chain and directing our efforts toward decarbonizing the largest sources of emissions. (pg 10)",2030,,,,N,,,,,,Yes,"Yes (nature-based removals e.g. Forestation, soil carbon enhancement)",Yes,N,,,,,,,,1,0,0,1,0,1,0,1,0,0,0,0,0,0,0,1,0,1,0,0,0,0,1,0,0,0,1,1,0,0,1,0,0,1,0,0,0,0,0,1,0,1,1,0,0,1,1,1,1,1,0,1,1,Y,No,N,"C, V",R,0,Y,,N,Y,Yes,
223,190,ArcelorMittal,Metals,Metals and mining,Luxembourg,Europe,"$62,441","$1,339",0.457,"$89,385",125416,21,N,,,Y,N,Commitment removed,,,,,,,,,,Net zero,Net Zero,Yes,Yes,No,"1,2",,N,,,,,C,Y,"1,2","Across our global portfolio our goal is to be net zero by 2050 and in Europe our target is to reduce our CO2 emissions by 30% by 2030 over 2018.
https://web.archive.org/web/20251004134240/https://corporate.arcelormittal.com/sustainability/approach/climate-change",2050,,,Yes,"Yes (CCS-based removals e.g. BECCS, DACCS)",No,N,,,,,,,,0,0,0,0,0,0,0,0,0,0,0,0,0,1,0,0,0,0,0,0,1,1,1,0,0,0,1,1,0,0,0,0,1,1,0,0,1,1,0,0,0,0,0,0,0,0,1,0,1,1,0,1,0,N,No,C,C,Y,Y,Y,,Y,N,Yes,
143,117,Archer Daniels Midland,Food Production,"Food, beverages and agriculture",U.S.,North America,"$85,530","$1,800",-0.483,"$53,271",43213,31,N,,,Y,N,Commitment removed,,,,,,,,,,Emissions reduction target,Other Emission Reduction,Yes,Yes,Yes,"1,2,3",,N,,,,,,N,,,,,,Not Specified,Yes (nature-based and CCS-based removals),No,Y,"(Pg. 23&25)
‚Äúwe are working with the Science-based Targets Initiative (SBTi) to obtain their approval that our sustainability targets align with ambitious goals to limit the average rise of global temperatures to 1.5 degrees Celsius‚Äù
(Pg. 3)
‚ÄúIn line with our commitment to align with ambitious goals to limit the average rise of global temperatures to 1.5 degrees Celsius, we submitted our Scope 1 + 2, Scope 3, and FLAG GHG emission reduction targets to the Science-based Targets Initiative.‚Äù",2050,,,,,,0,0,0,0,0,0,0,0,0,0,0,0,0,0,0,0,0,0,0,0,0,0,0,0,0,1,0,0,0,1,0,0,0,0,0,0,0,0,0,1,0,1,0,0,0,0,0,0,0,0,0,1,0,N,No,N,N,0,0,Y,,N,N,Not Specified,
224,245,Assicurazioni Generali,"Insurance: Life, Health (stock)",Financial services,Italy,Europe,"$62,196.4","$4,027.3",-0.006,"$557,721.1",86851,31,N,,,N,N,,,,,,,,,,,Net zero,Net Zero,Not Specified,Not Specified,Not Specified,,,N,,,,,,Y,,"Achievement of net-zero emissions by 2040 through financing of removal projects that will take into account the evolution
of sector-specific regulations.",2040,,,Yes,Not Specified,No,N,,,,,,,,0,0,0,0,0,0,0,0,0,0,0,0,0,1,0,0,0,0,0,0,1,1,1,0,0,0,1,1,0,0,0,0,0,0,0,0,1,1,0,0,0,0,0,0,0,0,1,0,1,1,0,1,0,N,0,"C, F",N,0,R,N,,Y,N,Yes,
270,329,AstraZeneca,Pharmaceuticals,Health care and pharmaceuticals,Britain,Europe,"$54,073","$7,035",0.181,"$104,035",94300,24,Y,2016,2025,Y,Y,Targets set,1.5°C ,2030,Targets set,1.5°C ,2045,Y,Targets set,2045,,Net zero,Net Zero,Yes,Yes,Yes,"1,2,3",,N,,,,,"C,V",Y,"1,2,3","""Reduce absolute Scope 3 emissions by 90% by 2045, from a 2019 baseline, to become science-based net zero""",2045,,,Not Specified,Yes (nature-based and CCS-based removals),Yes,N,,,,,,,,0,1,0,1,0,1,0,1,0,0,1,0,0,1,0,0,0,0,0,0,1,1,1,0,0,0,1,0,0,1,0,0,0,0,0,0,1,1,0,1,0,1,0,1,0,1,1,0,1,1,0,1,0,Y,Yes,V,N,0,Y,Y,Targets set,Y,N,Not Specified,
78,74,AT&T,Telecommunications,Telecommunications and media,U.S.,North America,"$122,336","$10,948",-0.24,"$394,795",140990,31,N,,,Y,Y,Targets set,1.5°C ,2030,,,,,,,,Net zero,Net Zero,Yes,Yes,Partial,"1,2",,N,,,,,C,Y,"1,2",2035 TARGET: Achieve carbon neutrality (net zero Scope 1 and 2 GHG emissions1) by 2035.,2035,,,Yes,Not Specified,No,N,,,,,,,,0,0,0,0,0,1,0,1,0,0,0,0,0,1,0,0,0,0,0,0,1,1,1,0,0,0,1,1,0,0,0,0,1,1,0,0,0,0,0,1,0,1,0,0,0,0,1,0,1,1,0,1,0,Y,No,N,C,Y,0,Y,,Y,N,Yes,
103,126,AXA,"Insurance: Life, Health (stock)",Financial services,France,Europe,"$98,686.1","$8,528.2",0.097,"$676,912.4",100041,31,Y,2017,2025,Y,Y,Committed,,2030,,,,,,,,Net zero,Net Zero,Not Specified,Not Specified,Not Specified,,,N,,,,,,Y,,"""We must now take steps to build out our roadmap to be consistent with our Net-Zero goal by 2050""",2050,,,Yes,"Yes (nature-based removals e.g. Forestation, soil carbon enhancement)",Yes,N,,,,,,,,0,1,0,1,0,1,0,1,0,0,0,0,0,1,0,0,0,0,0,0,1,1,1,0,0,0,1,1,0,0,1,0,0,1,0,0,1,1,0,1,0,1,0,1,0,1,1,1,1,1,0,1,1,N,No,F,"C, V",Y,U,Y,,Y,N,Yes,
478,#N/A,BAE Systems,Aerospace and Defense,Aerospace and defense,Britain,Europe,"$33,547.6",$30.9,-0.948,"$28,874.3",60038,3,N,,,Y,Y,Targets set,1.5°C ,2030,Targets set,1.5°C ,2050,Y,Targets set,2050,,Net zero,Net Zero,Yes,Yes,Partial,"1,2",,N,,,,,C,Y,"1,2","""Our near-term target and KPI, embedded in long-term incentives, is to reduce GHG emissions across our operations (Scopes 1 and 2) by 4.2% year-on-year. We continue to work towards our long-term target of ‚Äòworking towards a net zero value chain by 2050‚Äô."" (Annual Report 2023 BAE Systems plc, pg. 49).",2050,,,Not Specified,Not Specified,No,N,,,,,,,,0,0,0,0,0,1,0,1,0,0,1,0,0,1,0,0,0,0,0,0,1,1,1,0,0,0,1,0,0,1,#N/A,#N/A,#N/A,#N/A,#N/A,#N/A,#N/A,#N/A,#N/A,#N/A,#N/A,#N/A,#N/A,#N/A,#N/A,#N/A,#N/A,#N/A,#N/A,#N/A,#N/A,#N/A,#N/A,#N/A,#N/A,#N/A,#N/A,#N/A,#N/A,Y,Targets set,Y,N,Not Specified,
137,200,Banco Bilbao Vizcaya Argentaria,Banks: Commercial and Savings,Financial services,Spain,Europe,"$87,457.6","$10,872.7",0.254,"$799,753.6",125916,31,N,,,Y,N,Commitment removed,,,,,,,,,,Net Zero,Net Zero,Yes,Yes,Not Specified,"1,2",,N,,,,,C,Y,"1,2","In April 2021 BBVA announced the Net Zero 2050 commitment, which takes both direct and indirect emissions into account, including among the latter those of clients who receive financing from the bank.",2050,,,Yes,Not Specified,No,N,,,,,,,,0,0,0,0,0,0,0,0,0,0,0,0,0,1,0,0,0,0,0,0,1,1,1,0,0,0,1,1,0,0,1,0,0,1,0,0,1,1,0,1,0,1,0,0,0,0,1,1,1,1,0,1,1,N,No,V,C,Y,Y,Y,,Y,N,Yes,
